{
  "agent": "qa-gate",
  "envelope": {
    "autonomy_requested": "L2",
    "callback": {
      "T1": "state/a2a/outbox/orchestrator/",
      "T2": null,
      "T3": null
    },
    "capability": "qa.gate.run",
    "correlation_id": "C-01KYSFZVG4NNC3JRZQ00S781VZ",
    "created_at": "2026-07-30T12:29:04.900Z",
    "deadline": "2026-07-30T13:29:04.900Z",
    "from": "orchestrator",
    "idempotency": {
      "attempt": 1,
      "class": "scoped",
      "components": [
        "from",
        "to",
        "capability",
        "inputs_hash",
        "env_epoch"
      ],
      "env_epoch": "2026-07-30T12:29:04.899Z",
      "key": "sha256:2c91d9f3b9d6f42925d5ff14134fbfc0e03abf7dc0205c9ec6f209e2e2873ff0",
      "retry_of": null,
      "target_epoch": null,
      "ttl_s": 900
    },
    "input": {
      "suite": "chain"
    },
    "input_provenance": [
      {
        "field": "$.input",
        "source": "cli:orchestrator",
        "trust": "internal"
      }
    ],
    "priority": "normal",
    "schema_version": "2.0.0",
    "seed": null,
    "task_id": "A2A-01KYSFZVG4NNC3JRZQ00S781VY",
    "to": "qa-gate",
    "trace_id": "sha256:62a26a5c1f70fbed8da6ce903",
    "transport": "T1",
    "world": "prod"
  },
  "processed_at": "2026-07-30T12:29:05.119Z",
  "result": {
    "checks": [
      "[PASS] chain (1 workstream(s))"
    ],
    "ran_at": "2026-07-30T12:29:05.119Z",
    "suite": "chain",
    "verdict": "green"
  },
  "state": "completed",
  "task_id": "A2A-01KYSFZVG4NNC3JRZQ00S781VY"
}
